{
    "title": "Wyrdwood",
    "description": "",
    "youtubeplaylistid": "PL8DF056nV-PXEV5FLzVfASf8YPkH2dVk4",
    "thumbnail": "https://img.youtube.com/vi/H39LNrL_VH0/0.jpg",
    "status": "notStarted",
    "episodes": [
        {
            "title": "Folkmoot",
            "youtubeid": "H39LNrL_VH0",
            "description": "",
            "segments": [],
            "people": [],
            "uploadDate": "2024-09-13"
        },
        {
            "title": "Rootbound",
            "youtubeid": "uAn2kSNRLuM",
            "description": "",
            "segments": [],
            "people": [],
            "uploadDate": "2024-09-20"
        },
        {
            "title": "Howls In The Night",
            "youtubeid": "Pu-GlIu0Gqo",
            "description": "",
            "segments": [],
            "people": [],
            "uploadDate": "2024-09-27"
        },
        {
            "title": "The Path of Broken Oaths",
            "youtubeid": "rT5VwYxJbf8",
            "description": "",
            "segments": [],
            "people": [],
            "uploadDate": "2024-10-04"
        },
        {
            "title": "Ironclad",
            "youtubeid": "C7jK78NDyvU",
            "description": "",
            "segments": [],
            "people": [],
            "uploadDate": "2024-10-11"
        },
        {
            "title": "Shapes in the Mist",
            "youtubeid": "ZQy2XCq6ncc",
            "description": "",
            "segments": [],
            "people": [],
            "uploadDate": "2024-10-18"
        },
        {
            "title": "Friends & Falsehoods | Part 1",
            "youtubeid": "dWiIW6AofOk",
            "description": "",
            "segments": [],
            "people": [],
            "uploadDate": "2024-10-25"
        },
        {
            "title": "Friends & Falsehoods | Part 2 (Season Finale)",
            "youtubeid": "42i1EPA8DF4",
            "description": "",
            "segments": [],
            "people": [],
            "uploadDate": "2024-11-01"
        },
        {
            "title": "Mossfold",
            "youtubeid": "R-83J372K4g",
            "description": "",
            "segments": [],
            "people": [],
            "uploadDate": "2025-07-11"
        },
        {
            "title": "Homecoming",
            "youtubeid": "0igIO43iHnk",
            "description": "",
            "segments": [],
            "people": [],
            "uploadDate": "2025-07-18"
        },
        {
            "title": "Marsh & Malice",
            "youtubeid": "2v-zMkP9ti4",
            "description": "",
            "segments": [],
            "people": [],
            "uploadDate": "2025-07-25"
        },
        {
            "title": "The Fog",
            "youtubeid": "6Z8WwWA5bgg",
            "description": "",
            "segments": [],
            "people": [],
            "uploadDate": "2025-08-01"
        },
        {
            "title": "Angler",
            "youtubeid": "YcTOr5Ndduw",
            "description": "",
            "segments": [],
            "people": [],
            "uploadDate": "2025-08-08"
        },
        {
            "title": "Robin's Gambit",
            "youtubeid": "XBuXSWpfZYE",
            "description": "",
            "segments": [],
            "people": [],
            "uploadDate": "2025-08-15"
        },
        {
            "title": "The Tower | Part 1",
            "youtubeid": "p2_gsI6h21c",
            "description": "",
            "segments": [],
            "people": [],
            "uploadDate": "2025-08-22"
        },
        {
            "title": "The Tower | Part 2",
            "youtubeid": "ig44VIULM4U",
            "description": "",
            "segments": [],
            "people": [],
            "uploadDate": "2025-08-29"
        }
    ]
}
