{
    "title": "Fantasy High Sophomore Year",
    "description": "",
    "youtubeplaylistid": "PLhOoxQxz2yFOcJoLoPRyYzjqCbddeOjP4",
    "thumbnail": "https://img.youtube.com/vi/J5D0ij7cv-c/0.jpg",
    "status": "notStarted",
    "episodes": [
        {
            "title": "Sophomores Start",
            "youtubeid": "J5D0ij7cv-c",
            "description": "",
            "segments": [],
            "people": [],
            "uploadDate": "2019-11-20"
        },
        {
            "title": "Mirror Madness (Part 1)",
            "youtubeid": "I5rJSs8QxvY",
            "description": "",
            "segments": [],
            "people": [],
            "uploadDate": "2019-12-04"
        },
        {
            "title": "Mirror Madness (Part 2)",
            "youtubeid": "3o39rSn-K6o",
            "description": "",
            "segments": [],
            "people": [],
            "uploadDate": "2019-12-11"
        },
        {
            "title": "Havoc at the Hotel Cavalier (Part 1)",
            "youtubeid": "r8FZ9Tac5M8",
            "description": "",
            "segments": [],
            "people": [],
            "uploadDate": "2019-12-18"
        },
        {
            "title": "Havoc at the Hotel Cavalier (Part 2)",
            "youtubeid": "1zQIIYDUdCw",
            "description": "",
            "segments": [],
            "people": [],
            "uploadDate": "2019-12-25"
        },
        {
            "title": "Heartache On the Celestine Sea",
            "youtubeid": "7HAIf4iQYBY",
            "description": "",
            "segments": [],
            "people": [],
            "uploadDate": "2023-10-30"
        },
        {
            "title": "Leviathan Rock City",
            "youtubeid": "oO8DSwxVdlY",
            "description": "",
            "segments": [],
            "people": [],
            "uploadDate": "2023-11-02"
        },
        {
            "title": "Pirate Brawl",
            "youtubeid": "GB8uv1jXSZQ",
            "description": "",
            "segments": [],
            "people": [],
            "uploadDate": "2023-11-06"
        },
        {
            "title": "The Friendship Section",
            "youtubeid": "d2lU8zhuVR4",
            "description": "",
            "segments": [],
            "people": [],
            "uploadDate": "2023-11-09"
        },
        {
            "title": "The Row and the Ruction",
            "youtubeid": "8XQYpZQAcVk",
            "description": "",
            "segments": [],
            "people": [],
            "uploadDate": "2023-11-13"
        },
        {
            "title": "Fallinel",
            "youtubeid": "smiuY9H8DVM",
            "description": "",
            "segments": [],
            "people": [],
            "uploadDate": "2023-11-16"
        },
        {
            "title": "The Dangerous Mind of Aelwyn Abernant",
            "youtubeid": "ccnKkEUhLJs",
            "description": "",
            "segments": [],
            "people": [],
            "uploadDate": "2023-11-20"
        },
        {
            "title": "Revelations & Revivifications",
            "youtubeid": "7Yn261pjkaY",
            "description": "",
            "segments": [],
            "people": [],
            "uploadDate": "2023-11-23"
        },
        {
            "title": "Crustaceans & Crushes",
            "youtubeid": "mJQew0Z2Cqc",
            "description": "",
            "segments": [],
            "people": [],
            "uploadDate": "2023-11-27"
        },
        {
            "title": "Hellbound",
            "youtubeid": "TSPIIehP488",
            "description": "",
            "segments": [],
            "people": [],
            "uploadDate": "2023-11-30"
        },
        {
            "title": "Daddies & Demons",
            "youtubeid": "xLYoXMk41N0",
            "description": "",
            "segments": [],
            "people": [],
            "uploadDate": "2023-12-04"
        },
        {
            "title": "Blast From the Passed",
            "youtubeid": "unOsXrVtvlM",
            "description": "",
            "segments": [],
            "people": [],
            "uploadDate": "2023-12-07"
        },
        {
            "title": "My Green Heaven",
            "youtubeid": "RkE-YmIOSqI",
            "description": "",
            "segments": [],
            "people": [],
            "uploadDate": "2023-12-11"
        },
        {
            "title": "The Forest of the Nightmare King",
            "youtubeid": "qvH6QPMgdys",
            "description": "",
            "segments": [],
            "people": [],
            "uploadDate": "2023-12-14"
        },
        {
            "title": "Fearful Symmetry",
            "youtubeid": "gyQGz4UnJI8",
            "description": "",
            "segments": [],
            "people": [],
            "uploadDate": "2023-12-18"
        },
        {
            "title": "Spring Break! I Believe In You! (Part 1)",
            "youtubeid": "44Dmda_anto",
            "description": "",
            "segments": [],
            "people": [],
            "uploadDate": "2023-12-21"
        },
        {
            "title": "Spring Break! I Believe In You! (Part 2)",
            "youtubeid": "MnJI_KQhkR8",
            "description": "",
            "segments": [],
            "people": [],
            "uploadDate": "2023-12-26"
        }
    ]
}
